,title,body
186,I just found out someone I used to chat with online died 7 days ago.,"A fellow unschooling mom who I used to chat with about kids, video games, and Linux passed away 7 days ago and I feel awful because I just found out about it because her son posted on the Minecraft server they ran together (not on Facebook where all of us would see it) where another online friend saw it and mentioned it in a small Facebook group. 

Having most of your friends online is weird. And since we have known each other most of our kids' lives and we are getting older more of us are going to pass and not be nearby to comfort family and friends. And that is sad and weird."
187,‘Dog Treats’,"So I was just chilling on he couch, eating some beef jerky when my dog walks in and just stares at me and I realized
I just pulled a piece of meat that looks kinda like a dog treat out of a similar bag that her treats would come in"
188,"My SO is sleeping and said in his sleep, “oh, but would you have a sandwich?”",I snorted with laughter and a snot bubble came out of my nose.
189,I’m eating pizza and having an SVU marathon,"I haven’t eaten much all day except hot Cheetos bc I’m broke and that’s all I have right now til payday.
I’m bored so I’ve been watching SVU most of today."
190,An interesting non encounter,"Background: I am in college and there’s this one guy, I think his name is Matthew, I think a mutual friend introduced us once but we never talked or hung out. Regardless we know who the other one is and we see each other all the time. We never say hi, we just exchange weird glances. 

Well anyway, during Christmas break, me and a few friends go to Gatlinburg, which is like 4 hours away from my college. We’re sitting at a restaurant, when all of a sudden who do I see... 

That’s right! Matthew!! We do not say hi, we simply exchange awkward glances and will probably never speak of this"
191,I had a throat problem,"For some time, I had a problem where my throat would suddenly close up and make me gag, usually at the mention of food or a bad stench. Finally had enough and went to the doctor and the doctor asked the usual questions and said it was most likely stomach acid hitting my vocal cords. He gave me a prescription for some pills and told me to take one a day for three weeks.

I did so and since then I haven’t had the issue, but I lost my appetite. I used to have an iron stomach. I could eat a bowl of cereal, several chocolate bars, and drink a big glass of chocolate milk in one sitting and not even get so much as a stomachache. Now, I can hardly eat more than half a chicken strip without getting a strange feeling, not really a sick feeling, but an odd, almost empty feeling and it wouldn’t go away until I put the chicken back in the refrigerator.

Now, I usually lose my appetite at night, so I eat fine during the day, still not nearly as much as I used to, but a fair amount. Nighttime rolls around and the thought of eating makes me feel weird."
192,I got to train someone today!,As a cashier. Things lined up pretty well cause I got some good examples of everything. Someone did a return. Someone needed jewelry. People asked where things were. And someone was an asshole who for some reason thought it was okay to yell at the two of us and roughly grab my hand in anger and I got to explain retail diplomacy: instead of saying “get your filthy fucking hands off me” you give them the axe murder eyes and say “have a good day!”
193,I was an offended nine-year-old,"When I was nine, my mom made me a Facebook account so I could play games. My favorite game to play was called Petville. I loved playing it and I got my mom, and my grandma, and a few other family members to play it too. And one day I got my dad to play it. I was so excited because I loved having new pet friends for my pet. He shared some notification on Facebook that was something like “meet my Petville pet, Funky!” And then one of his friends commented “someone shoot that thing.”  

I was so upset and angry that someone would say that. Little 9 year old me was horrified someone could be so heartless, as I held Petville near and dear to my heart. I went to my dad all upset he’s like “oh, he was just joking” to try and comfort me. But I took that stupid comment so personally. 

I look back on it and just laugh now."
194,This story I found on a YouTube comments section on how he/she thought the Nazis were fictional,">I'd love to hear more of these, Doug!
Here's a great story about how the media impacted me when I was a kid. I was maybe 7 or 8 and my family were all attending a kid's art class. We had to draw hot air balloons with designs on them, and one of the very first things I drew on my hot air balloon was the Swastika!! The only thing I had seen it in until that point was the Indiana Jones movies, so I just thought ""Oh, I'll draw the symbol that the bad guys have in Indiana Jones!"" I thought the Nazis were fictional! XD

[here is set video,](https://www.youtube.com/watch?v=STOmR_nzE8w) as I set i found the story in the comments section, so sorry if you dont find it. also the video it self has a funny story on how Ghostbusters Drinking Got the YouTube Sent to the Principal"
195,"I was in my room with the door open, singing a South Park song.","The PC song to be specific. I got to the lyric ""I call WOO WOO on you!"" I guess I was really into it, mocking the guys voice and everything because my mom yelled at me to shut the fuck up from the living room."
196,The popular music from my high school days is now being played on the old people radio station,"It makes me feel old.  I remember my first job.  I was a dishwasher at a club where retired alcoholics hang out.  My coworkers would always have on the popular, new music radio station that the young people listen to.  I’ve always been more of a rock music guy, but I can enjoy pop and hip hop.  

I remember hearing these songs on the radio at my first job when they were still new songs.  I really liked some of them.  It would make me happy every time I heard them on the radio even if I heard them multiple times a day, and as time went on, and new songs kept coming out, I would start to miss the songs from months previous that they didn’t play anymore.

Now, these songs are on one of the old people radio stations.  My current coworkers are mostly 40+.  They’ll always put on this one radio station that mixes popular “new” music (songs from 2015 are the newest that they’ll play) with the old hits that they grew up with.  When I hear these songs now, it doesn’t make me happy.  It annoys me.  Instead of being cool new songs, they are now overplayed, old songs from years past.  I miss the days when I actually enjoyed these songs."
197,My floor used to glow,"When I was a kid I got this really cool solar system model, it had all of the planets (this is before there were only eight) and the sun, and the planets were relatively the right sizes compared to each other. Being the unfocused kid that I was I never put it together, but I did have fun with the glow in the dark paint that came with it. Until I spilled all of the paint on my carpet. In the daylight the paint and the carpet were the same color so the only way to tell something was wrong if it was light out was the stiffer section of carpet, but over the years it softened up and was indistinguishable from the rest of the carpet, if it was lit. If it was night and the lights were off there was an obvious large patch of carpet that glowed. 

Years after I spilled it the house was sold, but really, who looks at a house in the dark before they buy one? No way the new owners knew about the weirdly glowing patch before they closed and moved in."
198,My cat is snoring on my bed and it makes me happy,"I have a final in a few minutes and I’m kinda stressing, but my cat that I’ve had for almost 14 years is sleeping so soundly on the bed next to me. It’s just so relaxing to hear its breath and to know it feels safe and relaxed besides me, it really calms me down."
199,Vegan dreams,I had a dream last night that I was telling my mate I was doing veganuary (I am in real life) and he told me to prove it and speak in vegan then
200,I’ve never felt so bad in my life...,"I always thought I was strong, emotionally. I’ve never been anxious, I’ve never been depressed. I like to say I only have emotions for positive things; that I’m never sad, that I’m never down.

I’ve been in multiple relationships, but I’ve never really loved. I could easily get out of relationships without feeling bad, and I never felt dependent. It’ll sound bad, but one of my exes filled a test online to see if I was a sociopath. Turns out, according to that website, that I wasn’t.

I’m not saying everything is perfect. I’m pretty sure I have ADHD or at least ADD, but I’m too much of a coward to even ask about it. The last time I really went out of my comfort zone to get medical help, it was to make sure my penis was fine. Imagine having a hard time reading books, not doing anything about it, but as soon as there might be a problem with your dick, you jump in the first bus to get it fixed.

I’ve always avoided medical stuff, too scared of having anything. Recently though, I did it, took blood tests. I thought I was super lazy for not taking them before, but apparently it was the contrary: nobody does blood tests at 22, apparently. Just so this paragraph doesn’t look too short, I had nothing. No aids, no diabetes. I was fine.

I became motivated in fixing my life, cleaning my room, getting my bank and goverment stuff updated, even started cleaning my Iphone photos. It all came around the same time: when I met someone I loved, for real this time.

Don’t get me wrong, I didn’t know I wasn’t in love with my exes. I thought what I was feeling for them was love, but it wasn’t. It wasn’t because I’ve felt with the girl I met something I never felt before.

That girl, she’s leaving in another country. I’ve always been lazy about everything, but trust me, something happened with her. I got all my shit done, passport, photos, contacts, plane tickets, etc. I’ve done it all to go see her 3 weeks later. It was super early in our “relationship” but it felt like the good decision. And it was.

English isn’t my native language, please forgive me.

The trip was amazing, but I didn’t feel as good as I could. It was physical laziness, I was feeling weak. It was fucking with my whole self. It wasn’t that bad and everything went super well. We were in love and we’re still in love.

I came back, twelve days later. It was after she went to the airport with me. I had tears in my eyes and she didn’t, but I’d guess she was trying not to cry, or she just knew we’d still be there, together.

I wanted to cry so much. I never cry for real life situations, almost never. I cried after admitting to my ex I cheated on her, I cried when my other ex cheated on me. But other than that, I would only cry watching movies and shows. Me & Earl & the Dying Girl, or Andy talking about good old times on The Office, Why would I cry there?

In the best case scenario, I would feel good right now. She’s still in love with me, she’s coming to see me soon! I should feel like life’s good, finally. Life has always been ok, never that bad, never that good. **The love of my life loves me so much she’s coming to see me**. Yea, I should feel good.

I came back home from my trip. I slept normally, I don’t have any problem falling asleep, and I didn’t that night too, but I wake up wanting to die, literally.

I’ve never felt so fucking bad in my life. I didn’t even know what was going on. Some kind of pain in my chest. Google says anxiety, Google says depression. But what is it really? Dependency?

I went on Reddit recently, asking about people’s experiences (don’t look at my profile, it’s pathetic). Most of the people shared that feeling, but holy shit, it’s so bad.

And then, I started being shit, shit with her. Not that bad, and we’re still together, but my self-confidence, or whatever is it, is going downhill. I’m trying to change, to fix myself, but it’s so hard!

I would always have something to say, now I cannot find anything. I don’t know what to send, I don’t know what to reply, I don’t know how to react, I don’t know how to talk, to laugh, when to laugh. We keep on saying “I love you” but it’s so much, it seems like we’re trying to fill the lack of conversation by telling each other we love them, **but what the fuck do you reply to “I love you too”?** I fucking love you more? And then what?

Trust me, it’s not a rant about her. She’s perfect. She’s probably trying to handle my shitty behaviors, my boredom. It must be so hard. She’s trying to reassure me, that things are gonna be ok, that we’re both there, BUT I CANNOT CHANGE HOW I FEEL! HOW DO I DO FROM NOW?

I feel like shit, how do I fix that? I don’t wanna leave her! How will I feel then!? What do I do? What do I do.

I’m overanalyzing everything. It looks like by trying to find what could be wrong, I’m destroying our relationship, us. It’s clearly not what I want, but I don’t know how to do!

~~See, I’m sometimes taking screenshots of her, when we’re talking with the camera, or when she sends me photos. I’m not screenshotting anothing bad, only her cute face, the face I like the most. One time I’m like: “Do you wanna marry me”.~~ Dude, I don’t even wanna tell that fucking story, it’s pathetic.

When I was a kid, I felt so bad about my parents treating me worse than I thought I deserved. I wrote them a letter, telling them it wasn’t their fault. In my head I was gonna kill myself. I started crying and banging my head on whatever was hard and in my way. I couldn’t kill myself.

I don’t remember much about it, I remember where I was, how the room looked, the size of the paper, where I banged my head. Just enough to know that how I feel right now is worse than then. At that age, if I could’ve gone inside my head and go around my shitty personality, superiority complex or whatever it was, I would’ve seen that my mom loves me, even if she doesn’t want me to play Runescape. That my dad loves me even if he’s mad I suck at school.

But right now, I cannot even put my finger on what the fuck is happening inside of me. I’m not gonna kill myself, I’ve thought about it enough; I’ll probably fuck my life up before anything. We only have one life to live, eh?"
201,You ever just stir the air with your arm?,Im caffeinated to blitz and I can’t feel anything woooo
202,i keep getting zest in my eyes,"i go to bed pretty early but always stay up late in my room on the computer or reading and usually end up getting hungry before i fall asleep.  so that i don't have to get up in the night and go downstairs to the fridge, i make sure i have a bottle of water and some fruit when i go to bed.  lately i've had really good luck choosing nice oranges at the grocery store so that's what i've been bringing to bed with me.  also, i sleep with a fan on and have for years.  i need the noise and air flow or i have trouble sleeping.  the past couple of nights i keep doing the same stupid thing and peeling my orange right in front of the fan.  zest squirts out of the skin and the fan blows it directly into my eyes.  it's not a pleasant feeling."
203,white boy bro offends black friend,"I'm sitting here in the common room of the student union at my community college (I'm not college age, 28) & most of the ppl in the SUB are under 25.

There's this loud co-ed group of friends. Anyway, as they're playing cards this white kid yells out the N word & gets chastiiiiiiized hahaha"
204,I moved around my entire work schedule to enable me to go to class on Thursday nights.,My first class was supposed to be tonight but I just realized that it’s only an online class.
205,I have a six year old jar of pickles in my fridge.,This jar of pickles is old and the juice is milky in appearance. I want to see how long I can keep it for.
206,I saw a UFO and nobody believes me,"About 2 years ago I was on break at work having a cigarette when I saw this small group of lights appear from behind the restaurant behind us (we take smoke breaks in the back, so i was facing it). I’ve never seen anything move like that. It was NOT a drone and everybody I tell this story chalks it up to that. I can’t really describe the way it moved, almost like it was hovering. I stood there in literal shock watching this thing hover away, towards the mall which is across the street. I ran inside to tell my coworker as soon as I came to my senses and he thought I was crazy, but I know what I saw!"
207,I was withdrawing from a drug and didn't realize it.,"I've been feeling achey, tired and suffering a pounding headache for the last day. I bought an espresso to give me some needed boost. My symptoms vanished within 30 minutes. I think the coffee I've been making at home is decaff, even though the container says otherwise."
208,the disappearing train,"my mum was driving my friends back to his house (we had a play date) and we use the free way. I looked to my right and saw a train next to us, looked away for 3 seconds then it was gone. it wasn’t behind us or in front since there was a train station and it would have stopped.

this story wasn’t good enough to be on r/paranormal so it’s here lmao"
209,Tale of the Tomato Sea,"Once upon a time, there was a ship. A bird shat on the deck then it went for the sun. Now it lives there. 
The water was tomato sauce and the ship was made of diamonds. The sails were made of bird feathers. And the main deck was plastic. 
The Captain said, ""Why is that tree?""
And everyone started to whistle. Including the cat. 
The mouse only had 2 buttons and not the scroll one.
Then suddenly a whale jumped out of the water. It flapped its fin and it said ""blob plop gobly flysss"". And the crew began to dance. The cat was not dancing because it was already served on the table. The queen loved the taste of it.
But the Captain said not to dance because the Wi-Fi was gone. 
Then the crew started to make an app. The idea was that if you could draw a perfect chicken in the app, the phone would lay an egg. But if it's not good enough, then the chicken would simply cross the road. The app wasn't easy to make because the eggs keep coming out made of gold. Everyone hated that. 
A maid came and told about the cyborg on board. It only ate the mouse with two buttons. 

In the sea of tomato sauce, all pirates are Italian. 
And if you want some flavor
Just add some scallions. 

But why is the spaghetti not ready? 
Because there are no owls in the outer space."
210,I was at the soda machine,"This happened about a year ago. It was a minimum day at my highschool, the California sun reached into the 100s and my brokeass school didn't have no air conditioning. Everybody was sweating balls out there, you know how it is.

So anyways, I met up with my cousin and we made plans to go eat some pizza and get sodas to cool off. I honestly don't get a lot of time to spend with her cause of her controlling parents and our different friend groups, so I was trying to fit in as much stories as I could. Sadly, this led me to blabbering out loud the fact that I hadn't pee'd in literal days. My bladder was at a complete standstill and I don't know what the fuck I was thinking, but I thought it'd be funny if I said it out loud. 

So there I was, getting Powerade at the soda machine when this really cute girl walks up to me. Now let's be clear, I am a lesbian, so while this looked like any other altercation on the outside, the inside workings were very...different.

""You should probably go see a doctor if you haven't peed in a week. Trust me, I'm a nursing student ""

.That's literally all she said to me and as my cup overfilled with powerade I could feel my soul withering in the background of my cousin's ugly hacking laughter."
211,Met a lovely cat during my run today,"I was running today when I saw a cat up ahead on the opposite side of the sidewalk. So I cross the street so that we would cross paths. I ran up to the cat and started petting it and it was meowing at me, then it was rubbing against my legs and I told him that I had to continue on my run. Of course the cat did not understand, and started trotting along with me. So then I had to wait for the crosswalk instead of jaywalking like I normally do, because I didn't want the cat to get confused and then get run over by a car. Luckily when I crossed the street he stayed behind. I waved goodbye.

The truth is I ran to that part of town today specifically to see a cat (there's a lot of outdoor cats over there) so I'm really pleased that I accomplished that. I love that running gives me an excuse to do such a thing."
212,"At work, I have a fan on my desk that I turn on whenever I fart.",That's it.
213,Phantom milfs appeared out of nowhere,"I'm an adult now. This was years ago, but it haunts me. 

I'm about sixteen and it's Christmas day. I live in a strictly Catholic household. The closest I've ever gotten to viewing pornography is steamy softcore fanfiction.  I am innocent. 

It's that part of the afternoon where everyone is nursing sugar headaches and figuring out their new tech. I'm in my room fiddling with a new laptop or a new phone or new software or something. 

My room's a total mess-- there are archaeological layers of items that have been building up since my childhood. On my bookshelf there's a fat stack of CDs given to me by various jazz mentors. I play jazz saxophone, and every man who ever taught me jazz liked to throw CDs at me and go ""Listen to the greats! Play along with the recordings!"" 

My parents got a new speaker system, and my mom bursts into my room looking for some jazz CDs to test on the speaker system. She's riffling through a stack of CDs on my bookshelf when I hear, ""What's this?"" 

What follows is burned into my brain forever. My mother is brandishing a CD. I read the words on the label: \*All actors portrayed in these videos were over 18 and consented.\* I see the word \*Milf\*. 

""Do you know what this is?"" my mother says. 

""I've never seen this before in my life,"" I say, because it's the truth. I begin to realize what it is. ""Please get rid of it. I don't want it in here."" 

My mother clearly does not believe me but takes it away to the paper shredder to be disposed of. She presumably spends the rest of my teenage years wondering if I'm some kind of pervert. I spend the rest of my life terrified that pornography is going to materialize in my living space."
214,I blew bubbles into my fizzy water and it went flat,"Poured a nice can of lemon-lime fizzy water into a nice Yeti cup, threw a nice metal straw in there.  Started blowing bubbles. What fun this is, I thought. Super cool, super fizzy, extremely entertaining...then the fizzy water was fizzy no longer."
215,the first time i ever saw porn,"I was in 4th grade and beavers were my favorite animal so I Googled ""beaver pics"""
