,title,body
251,Lake tornados?,"I was just at a gas station and the guy ahead of me was talking to the cashier about how we’re supposed to get really bad weather tomorrow. The guy in line responded “It’s not like we’ll get any tornados or anything, there’s no big lakes around here” super confidently

I’m desperately trying to reconstruct the though process that leads someone to believe lakes are a requirement to have a tornado.  Like, I could understand someone not knowing what causes them, but what in the world makes you think lakes do? And the cashier responded “oh pressure differences cause them we could still get one” without a pause or anything like it was just a normal thing to hear. 

The entire interaction is fucking with my head so hard."
252,My dog is making me sleep on the couch.,"Over Christmas when I was at my homeplace my mum and I had a disagreement so I ended up crashing at my grandparents for the rest of the holidays. With my dog. My dog was used to my mum's place but there's a little more people traffic at my nan's. Plus it's only now that she's properly been allowed inside (my grandparents don't believe in keeping animals inside, I think they made the exception because they felt bad that my dog and I had nowhere else to go. My own house is two hours away.) So basically she's out of her comfort zone.

Welp, I sleep in the spare bed upstairs but no way josé is my dog allowed upstairs. As soon as bed time came, after I tucked her in and said goodnight, she would run up the stairs looking for me, noisily. Consistently. So I put her bed in the back hallway. She barked and barked (she's normally a very quiet girl) and whilst I couldn't hear her, my granda and my cousin's rooms were right next door so that wasn't an option. On the spot I couldn't think of anything to do other than sleep on the couch next to her bed in the living room. I did this for a whole week while I had a perfectly good bed upstairs but whatever, my back was sore but she was quiet and happy and my grandparents hadn't lost it about the fact that there was a noisy dog in their house! 

Fast forward to today, I'm visiting home again. We went for a 5k walk earlier so I figured she'd be too tired to bother chasing me around the house. Tucked her in, said goodnight and went upstairs to bed. After about 10 minutes I hear the familiar pitter-patter of her nails on the wooden floor outside my room. Back downstairs, tucked in, goodnight, only this time I made a barricade at the end of the stairs. 

I'm now waiting for her to either break through the barricade, or go to sleeps in her own bed next to the fire in the living room. Is this what being a parent is like?"
253,My dog is just so flippin adorable,Like she was sleeping next to me on one of her favorite blankets and I’m chilling next to her in a less comfy blanket. As soon as she wakes up she came and sat on my lap and laid her head on my chest and my heart just melted
254,A collection of stories,"Story 1: My kitten, Gerald, has big ears and big eyes. When he shakes his head, his ears flap loudly and it's hilarious. His eyes are even funnier, they are just so comically large. He uses his cute eyes to convince me to cuddle with him. Today, he waltzed into the kitchen and rubbed all over my legs and when I knelt down to love him up, he slammed his face into my palm and purred loudly.

Speaking of purring, his purr is really loud. One night, I was in the kitchen when I heard a loud rumbling sound from around the corner. I went to see what it was, and what do you know, it's Gerald! I have no clue why he was purring, I hadn't petted him, though I did sing a song about him and I guess I've called him by name so many times that he caught on and realized that when I said ""Gerald"" I was referring to him. That cat will purr about anything.

&#x200B;

Story 2: My lesson horse stepped on my foot. 

I take lessons every Friday and when I was finished, I took him to the barn to untack him and give him his carrots. When I pulled the bag of carrots out, Socks, the horse, stepped forward right on my foot. If I hadn't been wearing my boots and if he had kept most of his weight off it, my entire foot would be broken.

&#x200B;

Story 3: I cuddled my foster kittens.

I have 5 foster kittens and their momma. Prancer, the momma, is 2 years old and the babies were 3 weeks old when I got them, now about 10 or 11 weeks old. I made sure to give momma extra cuddles too, because she is going back to the shelter to get spayed and put up for adoption on the 15th.

The kittens are named Dasher, Dancer, Comet, Cupid, and the only girl, Vixen. Vixen is my favorite of the bunch. She's the only floofy kitten as well as the only girl. While I was with the babies, I scooped Vixen up and cradled her and told her that she is my favorite little floofer. Then I grabbed Dasher and told him that he is the most handsome little thing.

The other kittens didn't want to be picked up cause they were busy fighting, so I left them alone."
255,Wrong order at Starbucks,"I went to Starbucks today and ordered a white chocolate mocha frappuccino. When they handed it to me, it was white instead of the typical light brown. Turns out they made a white chocolate mocha cream frappuccino - without coffee. So disappointing."
256,"I spent too long deciding what to have for lunch, and now my lunch break is over. I'm going to have something extra good for dinner tonight.",Burrito or Thai food? A hoagie or dim sum? Greek food or soup and a salad?
257,Today in Earth Science the girl I paired up with introduced herself and asked me what my name was.,We were lab partners for the entirety of last semester.
258,“Pop-Up Ads”,"My dad was at the computer complaining about “all these damn pop-up ads” and when I looked to see what he was talking about, it turned out he was just right-clicking."
259,Deleting my dating apps has greatly improved my self esteem.,"I decided to delete my dating apps, due to feeling so insecure about myself both mentally and physically. I would look at all these people that were available and just felt I was an ugly person and no one would love me, if my hair wasn’t a certain way, I didn’t dress nice enough, or wasn’t as physically appealing as some of the other people. Once I deleted the apps,  I just stopped trying to compare myself so much to other people."
260,"Well, okay then.","Just spent 10 minutes typing up a hilarious story that I wanted to share, then dropped my phone and accidentally pressed the back button trying to catch it. Post, gone. My precious, hilarious memory, never to be heard by you lovely people. Many apologies :)"
261,I Quit My Job!,"After working a miserable office job for the past 6 months, I quit today! I have a new job that I start next week that will give me way more free time to dive into my hobbies. I'm excited and my life is starting to feel like my own again :)"
262,A Dead Fish and Two Packs of Cigarettes,"When I was a sophomore, I rode my bike to and from campus since I didn't own a car. I took a laborious but safe composition of dirt roads to avoid traffic on a highway notorious for traffic incidents. The trip consumed two and half hours of my daily routine, but I loved the slow pace and scenic views.

On my way home one afternoon, I spotted a pack of Marlborough Lights on the road and decided to pick it up. Recently opened, the pack only had a single butt missing. I assumed the owner made a last-ditch effort to quit that day by littering the pack on a drive to where-ever. *Perfect timing,* I thought. Deep into the most isolated road on my trip, I was ready to roll up a joint. However, the newly acquired consumable was a fantastic match for a my favorite crafting item: the spliff.

After igniting my afternoon, I mounted the bike and continued home. Approaching a green-iron bridge that crossed over to the next back-road, I noticed a dead fish in the middle of the opposite lane. Obviously, I stopped to inspect it. It was a bizarre sight. A bass, approximately ten inches in length, which still looked relatively fresh - probably a morning catch. I assumed the fisherman made a last-ditch effort to store it in an open cooler before hitting a pothole, or perhaps - in a state of carelessness - the catch fell from the roof of his vehicle before driving away. Unlike the pack of smokes, I decided not to pick up the fish. Nonetheless, my intrigue grew from the random treasures appearing on my journey.

A few miles later, I came to a hair-pin turn and around the corner - once again - a pack of cigarettes appeared. This time, a sealed pack of Camel Blues. I was fairly baffled and very high at this point. No longer was I in the mood for shallow assumptions. I tossed the Camels into my bag, stashed my bike in a thick patch of firs, and walked down a steep and rocky bank where I perched myself on a large boulder overlooking a river.

Peering down at the ceaseless currents, I thought about the flow of time, the flow of life, and the assortment of things people obtain that flow in and out of their possession. I thought about my trip and the idea of finding ""A dead fish and two packs of cigarettes."" It felt like a song. I wanted to write about it, find a story in it and sing it to the world.

Thirteen years have passed since that trip. I wrote down the title, but never composed a tune. With each passing day, the story grows more sentimental and seemingly less relatable. Yet, whenever I take that route, either by bike or car, I'm splashed with a sense of nostalgia and excitement - wondering if I'll spot another wild set of oddities and treasures.

&#x200B;

P.S. --> I'm a first time lurker & poster. Found this sub while browsing r/all. Hopefully I fulfilled the first rule (not sure if it's ""without purpose or utility"" as well as not boring) and I'm pretty sure it's not ""heavy."" If the mention of drug use is a big no-no, I'll delete it promptly. This is the one of the few stories I have that felt like it fit to my impression of the sub.

Anyway, thanks for reading!

edit: updated P.S."
263,Maytag commercials have given me a new fear,I love the commercials for Maytag with the guys running in place or things like that but now when I look at my washer or dryer I feel like someone is watching me.
264,I regularly cross the street to go to an on campus building so that I can take a shit.,"This has been going on for over a year. I rent a room in an old house across from campus. I also take fat shits.

Relevant sentence no.1 is relevant because my bathroom in my house is kind of disintegrating. The plumbing works (mostly) but the paint on the walls is peeling, everything is covered in a layer of decades of water marks, everything is weirdly laid out. I'm tall so when I sit on the bowl my knees are often inches away from the sink. The toilet roll holder is built into the wall so I have to physically twist my body to get toilet paper. The toilet bowl is also just tiny so my dick, which is average length, touches the edge of the bowl and there are few feelings I hate in the world than my circumcised dick feeling the cold pain of porcelain in the morning. My housemates also incessantly use the bathroom, their morning routines are like 20 minutes long so if I'm not waiting for them so that I can take a shit, they're waiting for me so that they can do whatever the fuck they do.

Relevant sentence no.2 is relevant because it's an old house and the plumbing isn't that great. I'm not sure if it's the healthiest thing for me but as a full time student working multiple jobs, I've condensed my daily meals into two large ones which are 700-1000 calories each just to encourage myself to eat less throughout the day and to save time; one in the morning and one in the evening. As a result I take some pretty fat shits. 90% of toilets are able to handle my shits, this one can't. It often gets clogged, even with the non fat shits that my housemates take.

Across the street is a campus building. It's really new and really nice. My campus has two types of toilet paper in its bathrooms: the literally just short of paper toilet paper they use in almost every building, and then the nice toilet paper they use in buildings with frequent high profile guests/professional conferences. This building is the latter. The stalls are floor to ceiling closed, nobody can peak at me taking my fat shit. The bathroom is cleaned multiple times a day. Everything in it is super modern Scandinavian architecture, the lighting is enough so you can see but dark enough that the mood is nice and low--not to mention its all recessed into the walls and ceiling so it's not direct light. It's water effecient too, so my shitting here is helping save the environment.

I'm planning on living in the same house next year so more likely than not this is going to continue."
265,Water bottle goes on a trip,"Sydney to North America is a lengthy flight, and as I only got 2 hours of sleep in this 40 hour day (yay timezones!), this was much more amusing than it had any right to be. After 12 hours, there's bound to be a thing or two that has fallen to the floor of the aircraft, and this time around, it was a relatively full water bottle. 

Upon landing, from somewhere behind me in economy, this water bottle begins to slide down the aisle (it was a square type of bottle, so the cap was pointed to the front of the plane; it wasn't rolling). As a plane has to slow from a couple hundred miles per hour to not-as-fast, this meant that the bottle would cover a bit of ground. It clears the bumps of the bulkhead, continues to slide for what feels like forever (this was probably about only 10 seconds), well past the divider for business class, stopping just short of the cockpit.

This water bottle just slid half the length of the aircraft in a straight line, which I had quite the chuckle at, though I can't imagine it was actually that funny. Maybe this could be a sample problem for a high school physics class."
266,I feel bad for killing bees but I'm allergic to bee stings.,I live alone and don't want to be found dead from a bee sting so if I'm alone at home I just kill all the bees that I find around me.
267,I'm not going to win the lotto,"At our office Christmas party they gave out Win For Life scratch off tickets.  I scratched it and won $12.25 (I borrowed a quarter to scratch it and then put it in my pocket.)  So I was like, I could buy lunch once, or I could let it ride.  Let's see how far I can take this.  So I got 6 more tickets, and won $30.  Got 15 more and won $12 again.  I looked up the odds; there's a 1 in 8 million chance of hitting the Win For Life.  It's ridiculous to think it will happen, but I can't stop myself from getting excited about it.  I haven't told anyone because I know how dumb it is to be excited.  

Anyway I'm gonna grab the next 6 tickets after work.  I'm not going to win, but I might."
268,My shitty start to the New Year.,"On New Year's Eve, about a couple minutes before the countdown I was binge watching some podcasts and drinking a few beers at home. I'd been doing it from about the evening (like 6 or so) As it got closer to the countdown I had to go to the toilet so I thought ""I'll try and be quick about it so I don't miss it."" Turned out I had to take a huge dump and as I was mid shit the countdown hit zero and I saw in 2020 having a crap."
269,I’m reading Ready Player One,"and I don’t really like it. Like, I’ll finish the book (I’m halfway through) but it feels very neck beard-y. Like the way Wade talks feels kinda like how every “nice guy” views himself. “Well I’m a little overweight but even though I’m only 18 I’ve memorized the entirety of 80s pop culture”."
270,I fell in love with a girl on Reddit,"I’ve been on Tinder for a while. I met some girls, dated some, Had sex with some. I didn’t really want to have sex though, but I didn’t mind to.

I met fun girls, fake girls, hipsters. I loved it, for a while, but I didn’t wanna be in a relationship with them, nor did I want sex.

I said in my bio: I don’t wanna be in a relationship, I don’t want sex; I want a good friend. Sadly, they all wanted more, and when I say all, it was three girls.

I stopped talking to two of them, dated one. I didn’t want to date her, but I didn’t want to lose her either. Half of my relationships went that way; I don’t wanna be in a relationship, but I don’t wanna lose them.

As I always do, I sabotaged myself to get away from her without hurting her. We weren’t in a relationship, and we stopped talking for a week after seeing each other for a month and half.

How did I sabotage myself? I slept with another girl, obviously. I didn’t want to sleep with her, I didn’t find her attractive either. I was drunk, I was high, I was not anywhere near leaving the other girl, didn’t wanna make her sad. It happened.

The other left me, and there I was: alone again.

The third girl was cool, but god damn. Not that I don’t like brazilians, but she’d kiss so hard, and she was into bdsm, as I’m the fastest cummer in the west.

I’m french, by the way, I’m sorry if it’s unclear: I cum really fucking fast, even when being slow, imagine bdsm sex.

I deleted Tinder, came back on my favorite app: Tik Tok. Of course this is a joke, I came on Reddit. I didn’t really know what I wanted, but I posted on some subreddits about meeting people, as potential friends or lovers. Found some people.

Most of them were weirdos, who’d draw dark stuff like dying people. Some were gay dudes who acted like they only wanted to be friends, some were girls who wanted to know more.

And then there was this girl; the last person who contacted me. She said she found me funny, or something.

“dicks are cool, but memes are cooler”. That was the title of the message, coming with:

“I’m not gonna lie. I’m very stoned right now and I’m not sure if cooler is a word, but fuck it dawg, life’s a risk.”

But that wasn’t the end of it. What sparkled my interest was this: “Terrible segway, but what is your favorite movie?”.

Say I’m egocentric, but I was so happy about that question. “My favorite movie would be Frank”

“Frank is one of my favorites too!”

Fuck. I don’t know what happened there but I didn’t think anyone would ever reply something around that. Everyone who I talked about Frank didn’t know about it, or would be like: “Is that the dude with a big head?” I was surprised, positively. And she also saw the documentary about it! What the actual fuck?

I then thought about something. Something really crazy and weird to think about, perhaps, but that was it: she was the one. It doesn’t sound crazy, so here’s the crazy part: I told myself she’d be the one I love, no matter what. No matter how I feel, no matter how she is: She was the one. The one I’d love for the rest of my life.

My only goal, from now on, was to make her happy. Of course life doesn’t work like this, so I didn’t go as planned.

We started talking, exchanged our Snapchat usernames, talked there, sent pictures of whatever we felt like, called each other; We were in love.

It took 42 days and I was with her, in real life. My lazy ass, who quit college 9 times, who works minimum wage in a shitty job at 22, did in a month more than I ever did in my life: get a passport, get plane tickets, get to her.

I flew from Quebec to her state, in the USA. I paid 600 bucks to see someone I didn’t know the month before, but I did it. And what if it was shit? It would still be something I did, inspiration to whatever I want to create in the future, perhaps.

I arrived there. The city was kinda ugly, I felt like someone was gonna stab me at any moment, but I was with the one I love. It felt better than anything, honestly.

Her friends thought I was gonna murder her, my family thought she was catfishing me, but she was who she was: the most beautiful, the cutest, funniest, smartest girl I’ve met. She was a hipster but what can I do about it.

We spent twelve days together. I initially thought I’d need 200 bucks but I probably spent over a thousand, though it was worth it. She’d go to work and I’d stay home with her cat or visit the city, but most likely stay home. I don’t know what the fuck was up with that city, but I felt lazier than I ever felt. We would still go out almost every night, get drunk and get high.

We had ups and ups only. It was perfect. I can admit I never liked drugs, and I still didn’t like them there, but being with her was perfect. You can tell it’s perfect when the thing I liked the least was a Youtuber, going by the name of L.A. Beast if anyone’s curious.

I came back to Quebec, and life became shit, for some days at least. It became painful. I didn’t know what. I’ve never felt anxious or depressed, but there was an odd feeling in my body. I even guessed it could be the weed that made me feel anxious, since I wouldn’t smoke before and I stopped smoking after. I thought “if weed makes you less anxious, maybe smoking some makes you feel anxious when you’re not smoking anymore”. Shitty english there, hope you understand. That’s the kind of thing an future addict would think, but I didn’t want to smoke; I wanted to feel good.

My last guess, and the one I stick with today, is that I’m emotionally dependent, to her. I’ve never been, but not being about to touch her, hug her, kiss her; it felt like shit.

The first night alone was so bad, I wake up and felt like shit. For some reason I was also behaving like shit, even with her. Not in a shit shit way, but rather in a “Sorry if I’m boring, I don’t feel very good” way.

Even if to this day, I miss the “real” her terribly, That weird feeling later passed. I also got sick during that time, even if I’m never sick. It was Christmas time too, what a time to be sick. I think god was trying to send me a message or something, but I completely misheard it, as I continued on loving her, even harder.

I came back on the 23rd of December, and on the 28th, she sent me a picture: she booked a flight to Quebec. I couldn’t believe it: someone liked me so much they were coming to see me.

She’s coming at the end of February, and I can’t wait for her to be here. I will try to find amazing stuff to show her, hopefully she likes it.

All my life I thought I’ve experienced being in love, but I’ve never been, until recently.

And it feels so good!"
271,The best driving road.,"I was on a Los Angeles to Seattle roadtrip in October. Just me and my car. I was coming home early October [when I saw a beautiful rest stop.](https://www.google.com/maps/place/Randolph+E.+Collier+Northbound+and+Southbound+Rest+Area/@41.8529827,-122.5741215,842m/data=!3m2!1e3!4b1!4m5!3m4!1s0x54ce515f39be6b7f:0x775424fa9709aa63!8m2!3d41.8529787!4d-122.5719328?hl=en) 

I remember I drove down one more exit, got off, and headed northbound towards the the stop. However, here's where my memory get's a little fuzzy. I remember making a hard right onto a road that followed the Klamath river for several miles.

The road intersected train tracks a few times, and there was some industrial buildings. I was less than 30 feet away from the Klamath river for miles, taking turns beautifully through their apex. I was flat out. At the top of 3rd gear in my old Mercedes, flying down the road which was empty, but full of signs of civilization. Beautiful autumn leaves, changing colors. There was a boat/ferry, which was surprising considering how small the river is. I just remember how at ease I was, and how amazing the road was to drive. Easily one of the best roads I drove on that trip.

 I pulled over and took [some pictures](https://imgur.com/a/X3J6EjR) of my car (It was the one year anniversary of ownership) but here's where the issues lies, my memory doesn't correspond to the google maps! I stopped a few miles down the road, took some pics, then headed back to that rest stop.I took [this video](https://imgur.com/a/uvt6mY5) and sent it to my Dad. You can clearly see the road across the river, I had just driven. And apparently Google didn't log that minor detour. I remember seeing a cafe, and it was closed. The only reason I am typing this up, is so that I go explore the area again, and find the cafe."
272,Yesterday I took home Mr. Mouse a.k.a m&m!,[Here he is!](https://imgur.com/gallery/gVvlmNs)
273,I ruined my cousins LEGO figurine,A  long long time ago when I was a kid I was at my cousin’s house and I was playing with her LEGOs and I took one of the LEGO figurines out to the backyard and I left it somewhere in the grass and my uncle ran it over with the lawn mower when he was mowing the lawn and it destroyed my cousin’s LEGO figurine it was the best day of my life
