,title,body
85,My life is turning into a Stephen King novel.,"**[CONTAINS MISERY SPOILERS]**

I finished reading *Misery* by Stephen King about a week ago. 2 days after finishing, I completely tore my left achilles playing soccer. In the book, the main character has debilitating leg injuries and eventually gets his left foot cut off in a gruesome scene. Having just read the book, I couldn't get over the irony of the situation.

 To make things even crazier, when I went to get surgery  on Tuesday to reattach my tendon, my nurse looked *very* familiar. She was the spitting image of Annie Wilkes. Tall, husky, black bob haircut. I nearly had a panic attack. I couldn't believe it. She asked why my heart rate was so high and I confessed. She thought it was hilarious. And teased my as the prepped me. When they started to put me under for the surgery, she leaned over me and said ""you dirty-birdy"" before I passed out. It's hilarious in retrospect but I was freaking out while going under."
86,So what had happened was..,"Last night or the night before, I'm not entirely sure, it was pretty late and my boyfriend and I were sitting in bed, with our electronic devices and snacks; basically just being bums. I've been consumed with my art, and online shopping, He's been playing his ""simulators."" I call them games, because that's what they are in my opinion. I try to explain to him that when he decides to go out, get a job, and buy his own devices, so he's not hogging mine, then he's welcome to call them whatever it is he feels like without my jokes. 

When I say game, I mean, he downloaded a flight ""simulator,"" where he tilts my phone from side to side, and just flies around with no real purpose. But yet he insists, ""Babe, It's not an effing game, It's a flight simulator. These are the exact controls used in real planes. They use this same program to train pilots. And pilots don't play games."" Insert my not uncommon eye roll. So I replied with, ""But real pilots know how to actually fly planes. You are not in school to learn how to fly planes. You're not in school or work for that matter. You are a pretend virtual pilot, and you don't know how to fly a plane."" He's always so quick to get defensive at this point, and believe me we have this debate more than once a day, so I'm technically just giving him a hard time for shits and giggles. Insomnia had been kicking my ass lately, and my mental health hasn't been in the best shape, so I tend to push his buttons a little bit more than I should. He's a pisces. Overly sensitive at times. He will go on to huff and puff about how if he had real plane, he would be able to get in it and fly it no problem because he's been practicing long enough on the ""simulator"" to know how to fly just like an actual pilot."" This is the third time this week he's made this outlandish statement. ""You've been playing this game for two months now and still at least more than once a day you get distracted by something irrelevant, and forget your flying. I'm just amazed you still get so shocked when the game starts blaring at you as your plane blow up into pieces. If you were a real pilot you would have died."" 

It's safe to say that once again, we found ourselves sitting on opposite sides of the bed, not speaking to one another because he's a child and I don't negotiate with terrorists. Oh! it wasn't last night, this was the night before last; but anyhow I was still being petty with the need to get just one more victory under my belt for the night, so all I could come up with was to break the silence in the best way I know how. Side note, whenever we're up in the wee hours of the morning, and everyone is sleeping, he absolutely hates when you startle him with any kind of super loud, out-of-the-blew declaration of noise. If I'm being honest I could have probably come up with something better, but chose to blurt out in this annoying, teenager girl in highschool meets rejected broadway performer, voice that he hates with a passion, 

""Are we going to wang chung tonight? Wannnnnng Chunngggggggg Toooooooooooonight?"""
87,Me going to the shops,"A few days ago, I traveled to the shops to buy some food. What I bought at the shops was 2 cucumbers and a six pack of fruitless hot cross buns. I then walked out like normal back to my car and I drove home."
88,Wedding thank you cards.,"Let me preface this by saying I'm not a heavy drinker. I drink a few times a year.


Although, since getting married it's a slightly more but still not a ton.


Anyway I have this 'I'm getting Meowied' glass my mom got me before I got married. (It was on my registry). And I just feel like it should be filled with champagne for wedding activities. Addressing the wedding invitations with my mom? Champagne? Check! 
Stuffing envelopes with my then fiance? Champagne? Check! You get the idea.


So finishing addressing our thank you cards should be no different. Except I'm home alone and they have to go out tomorrow to hit that three month mark. 

Fuck it, I'm drinking champagne by myself tonight. I YouTubed how to open the bottle and everything.


All is going well until I lose the stamps! Under the cards? Nope! Under the envelopes? Nope! With the heavy duty I weigh a lot stamps? Nope!
Surely they are lost within my list of addresses? Nope!


... They were on me. They fell on me at some point in time. It was a rollercoaster of emotions.


I'm almost done. Just took a break to post this."
89,I became a honorary member of a religion,I was leaving high school and these 70 year old men and women gideons were handing out free bibles. I’m not religious but me and my friend decided to take some. They didn’t mind. I was walking to the metro with my friend and one of the gideons was walking by and he said “do you want to give any of those books back?” And I said we are planning on giving these to our friends and family. The Gideon then said to us “god bless your souls. You are a honorary Gideon member.” Then I went home.
90,Unconsciously flirted with customer at my new job,"Some context. I haven't been employed in three years cause disability. This has all been pretty crazy... Circumstances decided that I had no contact with the opposite gender during that time. Or anyone else for that matter. In my defense haha. 

Just a peculiar experience for me is all. A girl came in that was about my age and exactly my type. I work retail so she was coming across the floor in front of me. I couldn't help but stare at her but I was too shy to say hi. She was a shorter blonde girl, pudgy cheeks, cute smile. So she said hello instead, and I said hi back. Few minutes later she comes to the register and we joke around a bit. She made a joke and I guess I was so distracted I didn't hear her so I didn't respond. She made a remark about being quirky and awkward then apologized. I rebuttal almost unconsciously and said I thought she was really funny in an obviously affectionate way. At that point I realized that definitely sounded bad, hah. During the next few seconds I had a really hard time not looking at her breasts, because, you know, *wow!* :I Fortunately my self-control game is strong. She wasn't uncomfortable or anything, and we both said goodbye in good spirits. 

So I feel kind of like I did something wrong but like I said it wasn't a conscious thing. I genuinely couldn't control that. Losing my first job in years because of debauchery would be bad. Should probably keep a lid on those feelings. I also thought I was gay for a long time. Ya... Unlikely!

idk, just wanted to share"
91,random,"so today I had a revelation that Sandy from SpongeBob is called Sandy because she is from Australia and there is a lot of sand there and I just checked and actually she is from Houston and when I googled if there's a lot of sand in Houston google disappointed me because, no, I don't want any sand delivered so yeah"
92,Not an untrustworthy poptart,"Just got mint mentos for my flight.  Bit into one in the middle of the pack and it was strawberry flavored, the same mint white color though.  Thought it was pretty cool."
93,Just left my number on a receipt.,"I’m over 30, haven’t dated in 12 years, and a good friend dared me $3 to put my number and “you’re cute, call me” on our dinner receipt. I never do this and I did it anyway.

Waitress was cute, asked probing questions, and provided more information than I’d normally expect.

She probably was working her tip up conversationally and earned it but I still feel like I’m in my early 20s over this whole silly thing."
94,I saw raccoons on my way home today.,"Today was a really busy today so I was walking home ~3 1/2 hours later than normal (throw off those stalkers, kids). I was walking my normal way when I saw a raccoon scurry around the corner. I followed it (I knew my friend would enjoy pictures of a raccoon) and I saw a pair of raccoons foraging under a tree. They were just chilling, doing their thing, a little upset I was watching them. I moved a little farther away to give them so space and they started chittering at each other, kinda fighting, kinda still foraging. Eventually we both went on our ways. 

They were cuties."
95,Biscuits with Extra Butter,"You know the cheddar bay biscuits, right? The ones from Red Lobster? My husband had bought a box of them the other day and we were on the hunt for a midnight snack.  


We open the box. Biscuit mix, and...two garlic seasoning pouches?  


""Huh, we can use it on something else later, if you want. Wanna save it?"" The idiot. The absolute goddamn fool.

""No,"" I clutch the two packets close to my chest. No one can take this moment from me. ""We're gonna make it all.""  


His eyebrows go up, his mouth open as he tries to force the ludicrous words from his throat. ""That's a lot of butter...""

My face feels tight, I realize now that my face has been contorted into a grinch-esque smile for ages now.  I know. I've always known. I was born knowing. 

I move quickly to the stove and start melting two sticks of butter. Husband is set to mixing the biscuit dough. I'm careful to only let it simmer--I can't ruin this with burnt butter. I know it's only supposed to be brushed onto the top, but I can't help this. Not when such a blessing has fallen into my lap. Was it a factory worker asleep at the button? Was I blessed, chosen? It didn't matter. The biscuits were in my kitchen now.

My husband pulls out a cookie sheet. The complete buffoon. I take the dough from him and spoon the biscuits into our cast iron pan. These bastards are getting toasted by the perfected seasoning of this black, beautiful cookware or I'll die baking.  


The 20 minutes in the oven was a lifetime. My husband was instantly sucked into his phone while I labored over the perfect butter. The herbs and seasoning swirling around as I stir, perfectly marrying the golden liquid I so desperately craved.   


Then, the moment came. I pulled them out of the oven. My perfect, perfect doughchildren had become robust biscuits. As I baptized them in the cherished garlic butter, I knew that I would never again accomplish something so bold, perfect, and awe-inspiring in my lifetime. I savored the moment almost as much as I savored the biscuits.  


Then, came the real indulgence. We had an entire stick's worth of melted, seasoned butter on reserve for this moment. I took that hot biscuit and gave it a healthy dip into the hot bowl of garlic glory. The butter danced around the crumbly outside, barely cutting through to the fluffy insides.  I was an absolute animal with butter dripping down my chin, crumbs flying everywhere as I bit into this buttery, crumbly example of the pinnacle of human achievement. The salty, garlicky, buttery bread crumble cured all my hatred and loathing for the world, if just for a moment. I looked upon the face of God, which also had crumbs and butter at the edges of its smiling lips, and knew that my place in Heaven was secured. This was my calling, my holy right, approved by God. This was my blessed miracle.

Only moments later I return from my flight of olfactory and palate joy to my husband enjoying a biscuit himself. ""Wow, good job. These are even better with the extra butter.""  


I know. Oh, how I know."
96,Gas,"“Any gas out there?”She asked while scanning a bottle of water.
I looked outside at the 12 empty pumps.
“Uh-uh” I replied. I had walked."
97,Needed more caffeine,"Apparently I needed more caffeine this morning. I sat down at my desk this morning and tried to put my computer glasses on without taking off my regular glasses. My only realization that I had done so was that the world started to look weird and they wouldn’t fit. 

My coworker offered me her computer glasses to go for the trifecta."
98,I’m so ridiculous,"Sometimes it’s  unbelievable how awesome of a person my S.O. is.  I can’t stand what a cool, interesting guy he is (in a good way). I don’t want to constantly be telling him that, cause I’m sure he already has rolled his eyes on the few occasions I’ve said something.  I just had to say something to someone and get that off my chest."
99,"Have a physics professor with a Russian accent. It feels weird to say, but it just fits and makes it more enjoyable.",Partikal model.
100,i have a 27 in my ELA class,thats all
101,Something terrible happened today,"This morning there was a little party at work for some guy who is retiring. I don’t know the guy at all but we were all forced to go down and spend 40 minutes smiling and shit. As soon as was acceptable I checked out the donut situation and discovered there was **one** Boston cream donut. Yes! I snatched that bad boy right up, this party was looking to be worthwhile after all. But 3 bites in and what should I discover but — it *wasn’t* a Boston cream donut at all! It was filled with some kind of chocolate goop.

Day. Ruined."
102,I hit my light switch with a Nerf blaster today,"For a good while I've been resolutely firing at it ~15 darts a day with a Nerf Jolt from 3-4m away. My switch is tiny and these things are inaccurate as hell, but today was special. I turned on my light. My struggle is over."
103,lady you forgot most of your groceries lol,"went grocery shopping with my roommate and sometimes older people I assume think we're a couple and give me dirty looks. 


today this lady looked at us and sneered at me and kept doing it every time she looked my way, I was behind her she was too busy sneering to notice she forgot one of her bags filled to the brim with groceries. just as she was about to walk out the door I yelled at her, ma'am you forgot your bag with a big smile. she refused to make eye contact when she came back to grab her bag but said thank you.

damn, that was funny."
104,going to work when suddenly a can of folgers,title is unrelated. work is going well though. i have a flight tomorrow and usually i prefer to sit in the middle seat but not this time.. ho ho no way. im going to the window
105,Got my very first parking ticket today,"Went out drinking Friday left it there, picked up today, boom ticket."
106,I tried to turn the speaker volume down with the TV remote.,It didn't work.
107,I heard a rock/metal cover of Careless Whisper and it was so jarring,"I think it was Seether's cover? And it's good, but it was just really weird hearing a distorted guitar playing the riff instead of a saxophone, like it actually took me a minute, like, wait a second, is that Careless Whisper?"
108,My mother can't see my sick AF drunk dancing cause she's passed out Dramamine,I'm giving my all and prolly making a bunch of noise but she's on them drammies so ain't even know
109,I can’t sleep because I’m farting so much it smells so bad,"Title. Had panda express for dinner. For hours and hours have been having these awful smelly egg farts. Pretty sure I woke myself up from a huge fart, and I can’t go back to sleep. Everything smells so bad.

E: My cat is being a trooper and doesn’t seem to mind. Good thing I’m single and alone so don’t have a woman to offend.

E2: nvm my cat left.

E3: I struck a couple matches and lit a scented candle. Maybe that will help.

E4: cat came back because he loves me.

E5: finally got to sleep but then I slept through my early morning alarm and now I am late for work."
110,Things the twilight zone made me think of,"At the end of ""the monsters are due on maple street"" Rod Serling said ""
The tools of conquest do not necessarily come with bombs and explosions and fallout.
There are weapons that are simply thoughts, attitudes, prejudices, to be found only in the minds of men. For the record, prejudices can kill and suspicion can destroy and a thoughtless, frightened search for a scapegoat has a fallout all of its own for the children and the children yet unborn. And the pity of it is that these things cannot be confined to the twilight zone.""

And it kinda made me think about how people act, like I've seen so many people get so caught up in the drama of maybe someone got into some scandal, and they're so quick to hate and scream at whoever it is without even knowing what actually happened. Idk what it was with James Charles, I wasn't really listening to that, but I saw so many people in like TikTok and instagram and Reddit everywhere, hating on him, he lost so many subscribers and then they found out he was innocent. Suddenly he's loved again. Why do people change their minds so fast?? And I do this too.  I don't even realize it but when I look back at what I've done, who I've agreed with, it's usually the popular opinion.  And that YouTuber who everyone said was cheating I forgot his name, turns out he's not cheating and same story, back and forth like a metronome . It's so scary to think that one misunderstanding can cause thousands upon thousands of people to run and hate you.  If I were famous and If something like that happened to me, say someone accused me of something then everyone who previously loved me suddenly wanted me denounced and hated. Once the misunderstanding was cleared up and all the fans came back, I would never trust them again. How could I?   Now that was just media influences that got it. What about politicians? I'm very stupid when it comes to politics but I know it's probably been getting heated. There probably won't be a war but all it takes is one misunderstanding. One mistake one insult gone too far and it could be over.   Idk"
111,Successfully had small talk,"At school, there is this huge door that a lot of students go through. Today, the wind slammed the door shut right before I went through and because it was slammed so hard, I couldn't open it. I pulled about three to four times and because I knew there was someone behind me and I didn't want them laugh at me silently, I turned and said ""Help."" (By the way, I said this quite desperately.) She got closer but right then I pulled the door open so it was a-okay.

Then, we walked side by side and we made small talk, talking about which year we go to and what our courses are. I learned that she studies office & retail to get a job as caretaker for children.

((When I asked her which year, she said fourth and I went ""Whoa, I thought you were a fifth or sixth year."" And when I told her I was a sixth year, she said ""Haha, I thought you were a fourth year.""))

And then we ended the two minute-long conversation because I had to go the other way and it was really nice and yeah.

I posted this because I'm quite awkward at regular conversations so I'm awful with small talk and I thought it was too pointless to tell anyone but I wanted people to know about my achievement."
112,Business card,"When I was about five years old. Me and my grandma went to this gardening store to get plants and seeds. I mainly just went there because I thought it was cool. Anyway we are walking around and I saw this table with things for people who were there. The table had likes cookies on it and their business card. I didn’t know that this table was for anyone was a customer. So I grabbed a business card. I thought I was stealing it and I have no idea why I would even want to do that, but then again why would they have 100 of them. Anyway I went home and immediately felt guilty. I couldn’t tell my mom that I’d done this. I hid the card under my bed so that my mom would not find it. Maybe a year later I told my mom what I’ve done, not thinking very much of it just a pointless story now. She told me that it was just a business card and that you were supposed to take them. I was dumbfounded. Now I look back on this is a funny story but it’s kind of pointless and no one really cares to hear it."
113,My family got another kitten and our two cats are finally getting along," We have had this cat for over a year, and she seemed lonely sometimes, and my mom and i wanted a kitten so we just kind of got one. Our first cat is very timid and more like a dog than a cat sometimes. Basically, she is weird and we thought it would take forever for them to get along. 

When the kitten first got here, she hissed at her every time she saw her for about two days. I’d wake up to growling and this kitten would be doing the arch^tm 

Yesterday though, the big cat was four feet away from the little one all day. At dinner they were chasing each other around and playing with each other! 

It’s weird, as they seem like polar opposites personality wise. One is shy and quiet, the other is veeery loud and outgoing. 

I’m just glad they won’t be hissing at each other for three weeks."
114,I seriously can’t tell if you’ve lost weight,"I can’t tell you how many times people tell me, I’ve lost 10 pounds! I’ve lost 20 pounds! Can’t you tell??? 

I absolutely never can. If I see you often, you always look the same to me. 

However, I’ve been starting to low key try to lose some weight by trying intermediate fasting and snacking on veggies, but nothing too serious, so I’m not expecting results yet. But like two people have told me already that I look slimmer.....?? I see no difference.  And I didn’t tell them I’ve been trying anything, either. 

I feel like I have a type of body dysmorphia where I can’t see changes in body lol, not even my own."
115,My sister is getting married and she asked me to be maid of honor!,"I'm so happy, I knew she finally found the right guy. And growing up we weren't really close, we fought a lot and really hated each other for a while. But since becoming adults we've grown closer, and it makes me so happy that she wants me to be MOH. I'm kinda nervous though lol, I have no idea what a MOH does, so I guess I'll have to do some research. Wish me luck 😅"
116,Kate Spade sent me an email about Apple Watch bands.,"I shop there often, so my local Kate Spade will sometimes email me about new deals. They just sent me an email regarding their new Apple Watch bands saying I was looking at them last time I was there. I don’t own an Apple Watch so I found this sort of silly."
117,I met the cat who lives upstairs today,"I've lived in my building for about two months now, and I kind of guessed the person upstairs had a cat, but I wasn't sure until today. I came home and he was just hanging out the the entry way (it's only a six unit building). I got to pet him and he really likes me. His name is Ricky and he tried to sneak into my room.

I guess his owner likes to just let him wander around sometimes?"
118,I think I looked like a crazy person in Starbucks today.,"I went to Starbucks today, which is quite rare for me. But they had a new seasonal drink, which I am just a sucker for. 

But I told myself that if I go there, I’ll finish preparing my lesson plan for an English lesson (ESL) that I have in two days. 

Keeping my promise to myself, I sat down with my drink and began writing the draft for my lesson.

I’m going to be teaching “this”, “that”, “these”, “those” to kids. To do so, I’ll be placing different numbers of objects around the room, and also giving the kids cards with the words on them so they can place the cards in the right places. I also use other cards like a “?” card to prompt asking a question. 

When I prepare my lesson plans, I often practice the lesson to see how it would work. Helps me find any flaws it might have, such as things that might be difficult for me to do or things that could be confusing for the kids.

So I’m in Starbucks, pretending to place invisible objects, pointing to invisible objects both near me (on the table) and far from me on an invisible whiteboard, hold up invisible cards, flip over invisible cards, clapping (silently) for the kids, making confused faces to prompt “what’s this?”, smiling to praise good work, 

I’m sure the other people here think I must be some crazy lady."
119,My 14 year old nanny kid just ran through the house screaming her head off.,"She screamed so loud my ears are ringing and I now I have a migraine and my ears hurt. 

There was a stink bug in her sisters hair."
