,title,body
0,The Announcement of the Return of the Weekly(ish) Pointless Question/Whatever-I-Decide (but probably Pointless Question) Threads,"What's this? One of Thortron's iconic weekly(ish) pointless question threads?

No, it's not. I don't even know why you would think it was, since the title clearly states this is just the announcement of the return of those threads.

*ANYWAY*

Hello, /r/PointlessStories storytellers! You haven't seen much of me in awhile, because blah-blah work and life; however, I have come to announce the return of those threads I make that ~5-10 people on average interact with.

What can you do to be ready? Submit suggestions for posts here and be recognized as the person that submitted that question, eagerly anticipate **January 6th, 2020** and the Return of the Weekly(ish) Threads, and not quit Reddit before that date."
1,What made you a Pointless Storyteller? The RETURN of the Pointless Question Thread [Weekly(ish) Pointless Question Thread],"Some of you may have thought that I had forgotten about the magnificent return of the pointless question thread, since it is the evening of the 6th in Western Hemisphere and the 7th elsewhere. Luckily, I never specified *when* on the 6th the return would happen. Anyway, I'm home from work and it is time to ask all of you a question: what made you a pointless storyteller?

To elaborate, in this thread we are talking about what brought you to our humble subreddit, why you stayed in this subreddit, or what sculpted you into a pointless storyteller. Feel free to interpret this question in other ways, but only if you comment and elaborate on that interpretation. Otherwise, I will be incredibly disappointed in you, and possibly even shake my head with a frown.

For me, I think I have always been a pointless storyteller. If anything, I would say that I had to learn how to tell pointed stories. Thankfully, this is a place where pointed stories are ***ILLEGAL***, and so I can just be myself. I would go into more detail, but I'm on a time crunch and also hungry.

Okay, I'm going to make dinner now."
2,Let me tell you about the time I accidentally ended up with a cult of middle schoolers worshipping me.,"During my senior year of high school, I volunteered as a mentor for middle school robotics. I would walk around to the different groups, asking leading questions, offering advice, and checking in on their progress. This was all well and good until one group of 7th graders decided that robotics time was just social time. The teacher who ran the LEGO robotics club told me to keep close watch over them and make sure they were using their time productively.

Instead of using their time productively, they decided that I was far more interesting than building a competitive LEGO robot. I started exchanging tidbits of conversation with them for productivity (e.g. “make the robot successfully complete two missions and I’ll tell you about my pet guinea pig”). This worked, but at a price.

They started considering me a friend and getting to know me, and I was happy to be a role model and an older sister character to them, but then *they got OBSESSED***.** I’d like to strongly emphasize that I did nothing to spur this on, but it started with stalking. They found my schedule on the school database and would come find me during my free periods. They’d try to drag me to their classes. They found my biology teacher and begged her to tell them what grade I had in her class.

Then, the religious cult stuff started. They said that if they didn’t talk to me every single weekday they would be “cursed.” They made a song about sacrificing themselves into a volcano for me and me reviving them. They made an altar to me. I did not attempt to encourage this behavior, nor did I suggest any of it. They just did this of their own accord. It got to the point where the school administration had to intervene because their behavior violated school rules. They slowly backed off on the cult thing after admin stepped in but it still took a whole year for them to fade out of my life. Anyway, it made for a rather memorable high school experience…"
3,One of my coworkers has the same name as me and also looks the same as me,"Not completely, like we both have long blond hair but his is straight and mine is wavy, we're both pretty thin and average height, but I've got a couple inches on him, plus he's ""punk thin"" and I'm ""distance runner thin"" if that makes sense, we both have beards but his is a goatee and mine is just a regular short beard, and he's usually wearing a leather jacket and jeans, while I'm typically in a t-shirt and ""athleisure"" shorts (yay for extremely casual dress code workplaces, and also having the Scottish gene that allows me to wear no clothes in the winter). People always think we're related, but we're not.

I've kicked around a few ways for people to differentiate between us. For instance (using John as a placeholder name) ""John C"" and ""John W."" Clear enough, but lacking in flair and a little inefficient. ""Guitar John"" and ""Piano John"" (we're music teachers). Not bad, but not terribly useful as we both teach both instruments, plus it has all the flow of a drum kit falling down a flight of stairs. ""Big John"" and ""Little John."" Technically correct, but ""Big John"" still being about 30 pounds under the average weight of an American man just doesn't feel right. ""Metal John"" and ""Ska John,"" eh, maybe, but the flow is a lot worse with our actual name. My favorite idea right now is to call him ""Shaggy,"" because he kind of looks like Shaggy from Scooby-Doo, and me ""Scooby,"" partly because *obviously* and partly because one time in university running club, we ran to this one spot on the river near campus where people liked to go swimming, and I jumped in the river with much the same energy (and appearance) as a golden retriever jumping in a pool, thus earning myself the nickname ""Dog Boy.""

In any case, this is never going to cause any confusion or get old."
4,Horror TV show sound design had me laughing in the dark,I’m at home playing a game and listen to one of those horror tv shows that dramatize people’s “real” stories. I don’t typically believe in the kind of stuff but still get freaked out watching the shows because I get really into them. I’ve got my headphones on because my wife is asleep on the couch. The tension is building and one of those whispering sound effects starts. It’s supposed to be one of those creepy breathing noises but instead it just sounds like a grown ass man whispering “reeeeeeeeee”. Nothing has ever taken me out of the moment faster. I laughed out loud. Thankfully I did not wake my wife.
5,Found used red panties in the middle of the sidewalk,"So, my friend and I went to Philadelphia yesterday to see the auto show. My friend had never been to Philly, so we also stopped at a few places. It was crazy to think there was a huge mixture of people taking the term “city of brotherly love” literally and being the nicest city folks I’ve met, while simultaneously I saw the grossest things ever.

I saw a street performer almost get into a fight with a street vendor over “corners“. I saw some guy get aggressive with his waiter over wanting his burger to not have buns (trust me, you can just say it once the waiter understood. Not to mention Hard Rock Cafe has gluten-free buns if you want. That’s what I got). 

Alternatively My friend wanted to see the Rocky statue, and there was a huge line to take a photo for it. So we waited, and realized there were some people at the front who were taking pictures for you. I was a little skeptical because I had heard of instances of this where they tried to charge you. However, these people weren’t. They were just trying to get the line going and making sure someone was there to take a picture. I just wanted to take a quick picture of my friend, because I don’t really have a connection with the movies. I insisted that I just wanted to take a quick picture of him, and the guy was like “aw but sweetie why wouldn’t you want one! You look very nice”. After a while he did let it go, and we got our picture quick when we got to the front of the line, and left quick. The tourists in Philly are also not as bad as other cities, The crowds were not as bad. Most people were understanding.

However, I think the best thing that happened, was we were walking around the George Washington monument outside of that art museum With the Rocky statue. We decided to not go into the museum, but rather walk around since we had a long drive home. As we were walking back, we saw some thing red in the middle of the Sidewalk. Apparently my friend thought it was a handkerchief that you tie around a dogs neck, that must’ve gotten dropped. I thought it was boxer briefs, that somebody just left for a gag. As we walked by, skirting as far away from it as possible, it looks like some poor drunk girl with a really nice Victoria’s Secret panties had just dropped them off right there. Very used, and very disturbing. I think it was the highlight of my trip."
6,Wait for the pun,"My freshman year of college I started at my first job, in a cafe on campus. One day, about a week or two in, we ran out of milk and so someone would have to go across campus to another location to borrow some and bring it back. As the newest employee and also the youngest, I was chosen... yay. 

Important details here to imagine the hilarity. I forgot to take off my hair net before leaving. I was wearing rubber clog looking no slip shoes, black pants, and a canvas material large grey shirt that went below my knees as there wasnt one in my size. It was also August and HOT. 

So, in all my cafe uniform glory, set off across campus with our cart to get the milk. Bear in mind campus was still very new to me and as I went I realized I didnt know how to get back using ramps. 

I get to the other location and they gave me like 8 jugs of milk and I stack them on to my little cart and start walking, trying to find a way back without stairs. Meanwhile I'm pulling this rickety cart on this cobblestone road making these annoying noises, trying to balance all this milk, and everyones staring and I want to cry BUT I got a job to do. 

I end up going around the full opposite side of campus and walking along side an insanely busy road on a super steep hill along the frat houses. As I walk down this road, feeling the eyes of the frat boys, looking like a 16 year old, and sweating up a storm... I hit a bump. 

Half the milk fall off my cart and burst, beginning to spill down the hill. I quickly gather them up, saving what I can. And go a little faster to get out of the embarrassment sooner rather than later, which ws a mistake. 

I hit another bump and this time all the milk jugs fall but 2 (one of which was already burst) and all of them burst besides 2. And as I feel the frat boy's and the driver's eyes on me, and the sweat dripping down my arms, and the impending doom of being fired from my first job, and watch the white milk spill down the hot busy sidewalk, all I can think is...

Dont cry over spilt milk. 

I laugh, I vomit a little bit in my mouth, but I don't cry. Then I pick up the damn jugs of milk, shove them on the milk covered cart and wheel it into the art building the cafe was located in. I walk down the hallway, dripping milk the whole way, art students judging me. I pass a janitor who sees my predicament and offers me his rag, as if it would help at all. 

Finally I make it to the cafe and tell my manager he should probably just fire me now. My manager tells me I need to be smarter than the average bear, tells me the short cut for next time, and tells me that everyone messes up sometimes. 

TLDR: Spilled a ton of milk, learned the true meaning of Don't Cry Over Spilled Milk"
7,i saw my dad watching larva the cartoon thing,"usually, you'd find my dad watching action movies, or anything that has fight scenes and guns and all that violent stuff but just earlier today, i found him watching larva."
8,Proudly showed my bare male ass to a really cute girl today,"I have a mild illness that's mostly gone now, but it was really annoying me this morning.  I decided to get a check-up and was asked if I wanted a steroid shot.  I said ""sure!"" and happily went about daydreaming about dumb shit not realizing what was about to happen.

A few minutes later, this super cute girl comes in to admininster the shot.  She had a great ass.  She says something very quiet that sounds like ""it'll be in your bottom"" while she gets stuff ready.  I wasn't fully paying attention cause I was ironically distracted by her ass but then I'm like ""...wait a minute.""

20 or so seconds later she says  ""ok, you ready?""  We pause and make eye-contact for an escruciating second.  I ask ""wait, where again?""  She says ""in your bottom"" very matter-of-factly.  I proceed to comment ""that what's I thought, but I wasn't sure and didn't want to make it awkward when it didn't have to be.""  Ok, it was more like ""oh ok I I thought so but I thought maybe you didn't say that but butt I ok.""  She just say ""it's ok.""

I'm like fuck it, it's gonna happen and she sees this all the time so I unbuckle my pants and drop them down, triumphantly displaying my Golden Globes in their full glory until she's done doing her job and we go about our separate ways.  I noticed the shot was in the very top corner near my hip and I'm like ""did I just moon this girl for no reason?""

Here's the part where I should note that this was at my workplace, and this is a girl I've never spoken to but gets reports from me all the time.  I texted a coworker who trains all the nurses and had this conversation:

Me: ""Lol I'm never coming to [redacted] again.  Just went and had to show my bare ass to one of the nurses lol""

Trainer: ""You went above and beyond, if it was for a shot you only needed to pull down the top corner lol""

Me:""Goddam""

""Fuck""

""I've never received a shot in the butt!""

""She probably thinks I'm an exhibitionist or something""

Trainer: *laughing faces*

Me: ""I'll do a sexy walk next time I see her."" *I proceed to explain who it is*
""If you see her tell her I had no idea wtf I was doing and was not trying to moon her""

Trainer: ""I will lol now do your walk of shame""

Me: ""Hell no I ain't ashamed of nothing, I flaunt what I was born with""

Trainer: ""This is the best *laughing faces* shake what your mama gave ya""

Now if I weren't married I'd probably follow this up the next time I see the nurse with ""well now that you've seen my bare ass, can I take you out sometime?""  My ex-girlfriends and wife all say I've got this perfect bubble butt and would always smack it plus I'm very hygenic, so I just hope she wasn't horrified or disgusted.  Fuck it, I'm gonna tell myself she liked it *pumps fist*.  Now every time I send a damn report she'll remember me as the proud pants dropping butt flasher.

So this whole thing was really not a big deal, but it was briefly a very ""oh shit what am I gonna do?"" situation before I decided to try to own it, and now the trainer and I are gonna have a good story to tell at the next happy hour lol."
9,I'm an idiot,I was at my physics lesson and went home. When I rang the door bell I realised that no one was home and my dumbass forgot the key.. Now I'm standing outside in the cold waiting for my pissed mom to leave work and bring me keys.. Idk how long it's gonna take her and I'm hungry.. Yay
10,Welcome to the neighbourhood,"I just moved into a new flat in a new neighbourhood a week ago. I'm liking it so far. It's roomy and the kitchen is big and it's cheap rent. It's also in a neighbouhood that I've always thought would be agreeable to live in, even though it's a block away from a pretty big, noisy, congested major street. I've been busy this week but have been sneaking out in the late evenings for a cheeky jazz cigarette, to kind of wander aimlessly around the area and get to know it better. Finding shortcuts, landmarks and other idiosyncrasies. 

My favourite part of getting to know a new neighbourhood, though, is meeting the local cats. I live in a cat obsessed and cat friendly city, so people let their cats wander around and are generally trusting. It's pretty great for a cat nutter like myself. I wasn't in my new flat for two days before I met the downstairs neighbour's little tuxedo cat through the window, and just now I met the greatest creature to ever grace the earth: a short, fat, stout, extremely loud and vocal, tailless calico cat. I couldn't read her nametag because when my hand got close to her chest she just rubbed her cheek into the palm of my hand aggressively, while meowing and purring at me. It was all I could ask for in a friendly neighbourhood cat. The best part was that she followed me home and came plumping after me up the stairs to my front door, like a loud, furry little barrel. 

I'm not a particularly optimistic guy, and I tend to be overly cautious about getting my hopes up about anything. But I can't deny that that was a pretty sweet welcome to the neighbourhood, and an awesome way to top off my cheeky jazz cigarette."
11,Weird shrooms experience,"Yesterday, I had a great time tripping on shrooms. I was with two guys I knew but the third guy I didn’t know but he seemed chill. So a few hours go by and and it was a great time really I loved the visuals.... but then two guys walked off and I was alone with the guy I didn’t really know. We were in a park where a lot of people were so I didn’t quite understand what was going through this guys mind because he was rambling.

All the sudden his arm is around me and I didn’t think it was anything crazy, until he pulled out a condom. He was like “we could do it right now.. no one would know” and there are people walking past as he is saying that and then it got kinda forceful and weird. So I had to clearly say no a few times. Then he seemed to be crying (I’m guessing maybe bc the rejection??).

After my friends came back we left since we all should’ve been coming down by that point. This guy is walking behind me talking to himself saying “I wanna die, I wanna die” and I had no clue whether or not to take him seriously.

I found out he is fine but wow I wasn’t expecting all that. I guess we were all at vulnerable states of mind but now I’m not going to trip again for a while."
12,When a stoner meets a drunk in public transport,"I finished work early one Friday and I thought I'd roll a joint and smoke that before heading home. I rolled a fattie and got really baked. After stumbling my way to the metro station, I eventually got on the train, giggling to myself at some stupid meme I remembered. And then I see this guy. He was 6'2 easily and was so red in the face. He was stepping all over his own and other passengers' feet. I knew he was drunk. And I couldn't stop laughing at that. The train started moving and he almost lost balance, despite holding those dangly grip things in each hand. He tried to take his phone out, somewhere during the journey and he dropped his pack of chewing tobacco. As he bent down to pick it up, the train braked so hard, he fell right on his face. Being high myself, it took me a great amount of self-control to not burst out laughing. Then my stop came and I had to get out. Pity I couldn't see the guy all the way till he got off at his stop. Hope he got home safe"
13,I take over people's chromecast when I'm bored,"I work at a University and a lot of the students stream spotify, youtube, netflix, etc. over a chrome cast. These dum dums don't disable the ""let others control your cast media"" feature so I'll mess with them and pause/play what they're casting. 

I know, I know, I'm an asshole. However, I'll also takeover their cast with a google slide and point them to a [link](https://www.techbout.com/stop-others-from-controlling-your-chromecast-device-42326/) that will show them how to disable it. It'll freak them out for a bit, but then hopefully they'll get smarter about what they're broadcasting over a public network."
14,My cat has been asleep on my lap for 6 hours.,"He's gone from a ball, to a loaf, to a flump,  to a sprawl. He's full burrito in a fuzzy blue blanket and, as I'm typing this, shrimp curling his entire head upside down under the covers. I can't get up. I can't even move. I'm cramped. I have to pee. Goddamnit moomoo..."
15,I tried to cut my toenails over the toilet bowl and dropped the nail clipper.,"Ugh. I watched the submerged nail clipper in the bowl for ages. Germaphobe me did not want to fish it out. Broke me didn’t want to spend on another nail clipper for something as stupid as that. Butterfingers me twiddles thumbs sheepishly.

Edit: [Here](https://imgur.com/gallery/W8Zs3pC) are my (finally) clipped nails! Can anyone approximate my height from my foot?"
16,I ate a tomato,"In culinary class Sophomore year of high school we had finished making Bruschetta and our teacher asked if anybody wanted to take some leftover ingredients home. So I took a tomato, and just took a huge bite of it. I don't even like tomatos. I was becoming numb. Ended up finishing it in class, and some dude was like ""you're one of those people?."" No, I'm not. I fucking hate tomatoes, why did I do it? I still have no idea what was going through my mind."
17,Just made kissy noises at a bag of potatoes for the last 5 minutes,It was dark and i thought the bag of potatoes on my kitchen floor was my cat. I was sitting in a chair in the living room and could just barely see it and i wanted my cat to come sit with me. I thought she was just being stubborn.
18,A deer started following me at night,"So I run around my neighborhood every night if I haven't already run during the day. My brother was coming home and saw something following me, so in the car he started to follow me as well to try and see what it is. (We live in mountain lion country so being cautious is definitely good) I didn't know if was him, but he told me there was a deer running after me. I honestly don't know what to take from this. I guess why? Is my main question."
19,My boyfriend is really sweet,"When we went to Walmart the other day, we walked past the hot spot, which had a huge stuffed animal shelf out front. I stopped so I could oogle at a large purple and blue dragon, then we moved on. When he came over last night, he handed me said dragon and my heart melted. The dragon's name is Wendel"
20,Baby poop,"It's 4 AM. My baby just had the noisiest sharts. My wife got up to change the baby. It was a little, and runny. Midway through wiping, my baby poops again. Now it's a lot. This time, it gets on her pajamas. Wife leaves to get new pajamas.  
I start wiping. Baby poops again. I wipe. She poops again. Yellow curry soft-serve, and now the diaper won't close. At least I think she's done."
21,Phantom Jesus poop,"Today for the first time ever I did a phantom Jesus poop. 
For those who don’t know what a phantom poop is it’s when you drop your poop and it disappears into the toilet (more common in deep toilets) therefor disappearing like you never even pooped !
Then with this trick shot I also went for the wipe and checked and there was no poop on the paper ! It’s like I never even went to the toilet ! For I have done my first phantom Jesus poop of my life."
22,I discovered bagels and now I’m an accidental vegetarian.,"I started dieting about a month ago and last week I found that a bagel with veggie spread was the perfect light lunch for me. I’ve been eating mushroom risotto, pierogi, or Thai vegetable curry for dinner and just realized that I haven’t eaten meat in over a week now. I think it’s the longest stretch of meatlessness in my entire memory and it was totally by accident. So yeah uh bagels are pretty awesome."
23,My cat turned my potatoes into peetatoes,"So for awhile my cat had been peeing outside his litter box, in the sink, the shower, the bathtub, the garbage cans, on plates and into bowls, in the closets, everywhere.

Including in my bowl of potatoes. I headed into the kitchen one afternoon to make myself a baked potato, only to find that my precious taters are wet and they smell like piss. Damn cat decided they should be peetatoes! 

I contacted the vet about it and he said to get a sample of it and bring it in for testing. I managed to get a sample on Tuesday and got the results back today. The cat’s got a UTI. He eats special dry food (it costs $70 a fucking bad, Jesus Christ) and he had a shot of antibiotics. I also have to clean all 8 litter boxes every single day because my 7 cats fill them up fast.

Maybe I have too many cats. Or maybe I have too few boxes. I think I will order more boxes and see if that helps too."
